{"protocolVersion":"1.0","artifactId":"66666666-6666-4666-8666-666666666666","organizationId":"22222222-2222-4222-8222-222222222222","jobId":"33333333-3333-4333-8333-333333333333","type":"JOB_OUTPUT","direction":"AGENT_TO_CONTROL_PLANE","contentType":"text/plain","originalName":"artifact.txt","sizeBytes":20,"sha256":"cccccccccccccccccccccccccccccccccccccccccccccccccccccccccccccccc","status":"AVAILABLE","createdAt":"2026-08-11T12:00:03Z","uploadedByAgentId":"11111111-1111-4111-8111-111111111111"}
